{
  "$schema": "https://json-schema.org/draft/2020-12/schema",
  "$id": "https://4ur4.local/fixtures/schema/real-causal.schema.json",
  "title": "4UR4 Real-Market Fixture — expected-causal.json (SPR-D-01 Half B)",
  "description": "Machine-validated shape for the AS-OF-TIME (Half B) expectation of a real-market fixture. This is TEST DATA / RESEARCH EVIDENCE under the GOV-015 build-freeze, not product implementation. It is deliberately a SEPARATE document from fixture.schema.json: the golden schema requires a GX-\\d\\d id and a full transition list, and admitting a real fixture into it would have meant WEAKENING the golden gate (relaxing the id pattern and demoting required fields). A new document type is the smaller, purely additive change. Per SPR-D-01 Limit 1, the asserted surface is Phase-2-owned behaviour ONLY: the formation trace, the as-of-time selection over the bars strictly before the stop, and line_at_stop. It asserts NO frozen line, NO BROKEN_OUT state and NO BREAKOUT_CONFIRMED reason code — those are Phase 3's. Per SPR-D-01 Limit 3, if the values here were generated by tools/fixture-replay.mjs they are MODEL-DERIVED and this document is a regression guard against today's reference model, NOT an independent correctness check; `provenance` must therefore state that on the artifact's face.",
  "type": "object",
  "additionalProperties": false,
  "required": [
    "fixture_id",
    "layer",
    "purpose",
    "spec_refs",
    "provenance",
    "assertable_surface",
    "not_asserted",
    "params",
    "input_binding",
    "formation",
    "as_of_time_selection",
    "line_at_stop",
    "non_endorsement"
  ],
  "properties": {
    "fixture_id": {
      "type": "string",
      "pattern": "^RM-[0-9]{2}$",
      "description": "Real-market fixture identifier, e.g. RM-01. Distinct namespace from the golden GX-\\d\\d ids."
    },
    "layer": {
      "type": "string",
      "const": "as-of-time-half-b",
      "description": "Names which of RM-01's two records this file is. Half A (the full-series geometry) lives in annotation.json and is NOT restated here; neither layer supersedes the other (SPR-D-01)."
    },
    "purpose": {
      "type": "string",
      "description": "One-sentence statement of what this document locks."
    },
    "spec_refs": {
      "type": "array",
      "items": { "type": "string" },
      "minItems": 1,
      "description": "Spec sections and decisions relied on, e.g. ['§21.5','HD-12','SPR-D-01']."
    },
    "provenance": {
      "type": "object",
      "additionalProperties": false,
      "required": [
        "generated_by",
        "derivation",
        "is_independent_verification",
        "guard_kind",
        "author_independence",
        "note"
      ],
      "description": "SPR-D-01 Limit 3 requires the Half B artifact to state its own provenance ON ITS FACE, not only in the register.",
      "properties": {
        "generated_by": {
          "type": "string",
          "description": "The tool that produced these values, e.g. 'tools/fixture-replay.mjs' — the HD-15-permitted causal reference model."
        },
        "derivation": {
          "type": "string",
          "const": "model-derived",
          "description": "MUST be 'model-derived'. These values come from the reference model, not from an independent human re-derivation. Stating anything else would overclaim exactly as SPR-D-01 Limit 3 forbids."
        },
        "is_independent_verification": {
          "type": "boolean",
          "const": false,
          "description": "MUST be false. RM-01's non-circularity attaches to Half A's human-approved geometry and to the real, undesigned prices — never to Half B's provenance."
        },
        "guard_kind": {
          "type": "string",
          "const": "regression-guard-against-current-reference-model",
          "description": "What this document actually is. It detects drift from today's model; it cannot detect that today's model is wrong."
        },
        "author_independence": {
          "type": "string",
          "description": "HD-15 condition 2 / E2-AUTHOR attestation: who authored this file, that the author READ tools/fixture-replay.mjs and is therefore DISQUALIFIED from authoring the Phase 2 engine, and that the Phase 2 engine author must be a different agent that has read neither this file nor the reference model."
        },
        "note": { "type": "string" }
      }
    },
    "assertable_surface": {
      "type": "object",
      "additionalProperties": false,
      "required": ["bars_from", "bars_to", "plus_stop_index", "rationale"],
      "description": "SPR-D-01 Limit 2: Half B NARROWS RM-01's Phase-2 assertable surface. Stating the surface explicitly is what stops a later reader from re-expanding it.",
      "properties": {
        "bars_from": { "type": "integer", "minimum": 0 },
        "bars_to": {
          "type": "integer",
          "minimum": 0,
          "description": "Inclusive last bar whose as-of-time selection is asserted. Must be stop_index - 1."
        },
        "plus_stop_index": {
          "type": "boolean",
          "const": true,
          "description": "Correct identification of the stop index is asserted in addition to bars_from..bars_to."
        },
        "rationale": { "type": "string" }
      }
    },
    "not_asserted": {
      "type": "object",
      "additionalProperties": false,
      "required": ["fields", "rationale"],
      "description": "The explicit exclusion list. A gate that only says what it checks silently grows; this says what it deliberately does not.",
      "properties": {
        "fields": {
          "type": "array",
          "items": { "type": "string" },
          "minItems": 1,
          "description": "Must include the frozen line, the final state, and the BREAKOUT_CONFIRMED reason code (SPR-D-01 Limit 1)."
        },
        "rationale": { "type": "string" }
      }
    },
    "params": {
      "type": "object",
      "additionalProperties": true,
      "required": ["tolerance_version", "eps_break_locked"],
      "description": "The ratified HD-14 / D-TL-12 parameter set used to derive every value below.",
      "properties": {
        "eps": { "type": "number" },
        "eps_touch": { "type": "number" },
        "eps_break": {
          "type": "number",
          "description": "ILLUSTRATIVE, NOT LOCKED (HD-03/HD-13)."
        },
        "eps_break_locked": {
          "type": "boolean",
          "const": false,
          "description": "MUST be false — eps_break is versioned and backtestable, never locked."
        },
        "min_formation_bars": { "type": "integer", "minimum": 1 },
        "min_ath_age_bars": { "type": "integer", "minimum": 0 },
        "tolerance_version": { "type": "string" }
      }
    },
    "input_binding": {
      "type": "object",
      "additionalProperties": false,
      "description": "Ties this expectation to the exact committed bytes it was derived from, so a silent input edit cannot leave a passing gate.",
      "properties": {
        "input_csv": { "type": "string" },
        "input_csv_sha256": { "type": "string", "pattern": "^[0-9a-f]{64}$" },
        "bar_count": { "type": "integer", "minimum": 1 },
        "timestamp_kind": { "type": "string", "enum": ["ordinal", "iso_date"] },
        "price_field_for_geometry": { "type": "string", "const": "high" }
      }
    },
    "formation": {
      "type": "object",
      "additionalProperties": false,
      "required": ["t_form", "B_star_at_formation", "log_slope_at_formation", "gate_trace"],
      "description": "§21.3 formation gates F1/F2/F3, evaluated causally.",
      "properties": {
        "t_form": {
          "type": "integer",
          "minimum": 0,
          "description": "First bar at which a line is ACTIVE."
        },
        "B_star_at_formation": {
          "type": "object",
          "additionalProperties": false,
          "properties": {
            "t": { "type": "integer" },
            "H": { "type": "number" }
          }
        },
        "log_slope_at_formation": { "type": "number" },
        "gate_trace": {
          "type": "array",
          "minItems": 1,
          "items": {
            "type": "object",
            "additionalProperties": false,
            "required": ["t", "eligible"],
            "properties": {
              "t": { "type": "integer" },
              "eligible": { "type": "boolean" },
              "reason": {
                "type": ["string", "null"],
                "description": "Why the line is not yet ACTIVE at t; null once it is eligible."
              },
              "f1": { "type": "string" },
              "f2": { "type": "string" },
              "f3": { "type": "string" }
            }
          }
        }
      }
    },
    "as_of_time_selection": {
      "type": "array",
      "minItems": 1,
      "description": "Per-bar as-of-time state for every bar in the assertable surface. Each entry is derived ONLY from bars strictly earlier than the bar it judges (§21 / HD-12 / D-TL-11).",
      "items": {
        "type": "object",
        "additionalProperties": false,
        "required": ["t"],
        "properties": {
          "t": { "type": "integer", "minimum": 0 },
          "date": { "type": "string" },
          "B_star_t": { "type": ["integer", "null"] },
          "B_star_H": { "type": ["number", "null"] },
          "log_slope": { "type": ["number", "null"] },
          "intercept": { "type": ["number", "null"] },
          "y_hat": { "type": ["number", "null"] },
          "line": { "type": ["number", "null"] },
          "no_line_reason": {
            "type": ["string", "null"],
            "description": "Set when no line is active at t, e.g. INSUFFICIENT_BARS."
          }
        }
      }
    },
    "reselections": {
      "type": "array",
      "description": "Pre-stop re-selections of B* (§21.6), each recorded with the bar it takes effect on.",
      "items": {
        "type": "object",
        "additionalProperties": false,
        "required": ["effective_bar", "from", "to"],
        "properties": {
          "effective_bar": { "type": "integer" },
          "from": { "type": ["integer", "null"] },
          "to": { "type": ["integer", "null"] },
          "log_slope": { "type": "number" },
          "trigger": { "type": "string" },
          "tie": { "type": "boolean" }
        }
      }
    },
    "line_at_stop": {
      "type": "object",
      "additionalProperties": false,
      "required": [
        "stop_index",
        "stop_index_is_engine_derived",
        "A",
        "B",
        "log_slope",
        "intercept",
        "y_hat",
        "line",
        "close",
        "close_vs_line_log",
        "close_vs_line_plus_eps_break_log"
      ],
      "description": "The line ACTIVE AT the stop bar — explicitly NOT the frozen line Λ^F (SPR-D-01 Limit 1).",
      "properties": {
        "stop_index": {
          "type": "integer",
          "minimum": 0,
          "description": "The bar at which Phase-2-assertable behaviour stops."
        },
        "date": { "type": "string" },
        "stop_index_is_engine_derived": {
          "type": "boolean",
          "const": true,
          "description": "SPR-D-01 Limit 1b: the stop index MUST be derived by the engine, never supplied to it by the fixture or the harness. A harness that hands over the stop index makes the B-clause assert nothing about the engine's own detection."
        },
        "A": {
          "type": "object",
          "additionalProperties": false,
          "properties": { "t": { "type": "integer" }, "H": { "type": "number" } }
        },
        "B": {
          "type": "object",
          "additionalProperties": false,
          "properties": {
            "t": { "type": "integer" },
            "H": { "type": "number" },
            "date": { "type": "string" }
          }
        },
        "log_slope": { "type": "number" },
        "intercept": { "type": "number" },
        "y_hat": { "type": "number" },
        "line": { "type": "number" },
        "close": { "type": "number" },
        "close_vs_line_log": {
          "type": "number",
          "description": "ln(close) − y_hat — the RAW clearance, tolerance-GROSS. This is the quantity SPR-D-01, roadmap.md and fixtures/README.md all call 'the margin' (0.0864461 for RM-01), and it is the one the 'suppression needs eps_break ≥ margin' statement refers to."
        },
        "close_vs_line_plus_eps_break_log": {
          "type": "number",
          "description": "ln(close) − (y_hat + eps_break) — the tolerance-NET excess. This is the quantity tools/fixture-replay.mjs stores in its own events[].margin field (0.0764461 for RM-01). Recorded under a distinct name because the two differ by exactly eps_break and an unqualified 'margin' has two readings."
        }
      }
    },
    "robustness": {
      "type": "object",
      "additionalProperties": true,
      "description": "HD-13 requires ordinary fixtures to be tolerance-robust. Sweeps are recorded so a fragile expectation cannot pass unnoticed.",
      "properties": {
        "eps_break_sweep": { "type": "array" },
        "eps_sweep": { "type": "array" },
        "min_formation_bars_sweep": { "type": "array" },
        "verdict": { "type": "string" }
      }
    },
    "non_endorsement": {
      "type": "string",
      "description": "SPR-D-01's mandatory non-endorsement clause, required to appear ON THE ARTIFACT and not only in the register: this is an evidentiary conformance expectation, not an economic endorsement."
    },
    "geometry_check": {
      "type": "object",
      "additionalProperties": true,
      "description": "Restated arithmetic so an independent verifier can confirm every number by hand."
    }
  }
}
