{
  "$schema": "../../schema/real-causal.schema.json",
  "fixture_id": "RM-01",
  "layer": "as-of-time-half-b",
  "purpose": "Places RM-01 under mechanical causal replay for the first time. Locks the Phase-2-owned half of SPR-D-01: the formation-gate trace, the as-of-time selection over bars 0..9, and line_at_stop at the engine-derived stop (bar 10). Half A — the full-series geometry — lives in annotation.json and is not restated here; neither layer supersedes the other.",
  "spec_refs": [
    "§8",
    "§21.3",
    "§21.4",
    "§21.5",
    "§21.6",
    "D-TL-11",
    "D-TL-12",
    "HD-11",
    "HD-12",
    "HD-13",
    "HD-14",
    "HD-15",
    "SPR-D-01"
  ],
  "provenance": {
    "generated_by": "tools/fixture-replay.mjs",
    "derivation": "model-derived",
    "is_independent_verification": false,
    "guard_kind": "regression-guard-against-current-reference-model",
    "author_independence": "Authored by the orchestrating session of 2026-07-26, which HAS READ tools/fixture-replay.mjs and is therefore permanently DISQUALIFIED from authoring the Phase 2 engine (HD-15 condition 2 / E2-AUTHOR-B). The Phase 2 engine must be authored by a different agent that has read neither the reference model nor this file. E2-AUTHOR-A governs where the two diverge: the committed engine/ must not import, copy, execute or mechanically translate the reference model, and that is the property assessed at the gate.",
    "note": "SPR-D-01 limit 3 resolved to its TRUE value for this artifact. The limit is stated conditionally elsewhere (\"if the Half B expectation is generated by tools/fixture-replay.mjs\"); for this file the condition HOLDS. These values were produced by applying the reference model to RM-01 bars, so this document is a regression guard against today's model and CANNOT detect that the model itself is wrong. RM-01's non-circularity attaches to Half A's human-approved geometry and to the real, undesigned prices — never to this file's provenance."
  },
  "assertable_surface": {
    "bars_from": 0,
    "bars_to": 9,
    "plus_stop_index": true,
    "rationale": "SPR-D-01 limit 2: Half B NARROWS RM-01's Phase-2 assertable surface. Under Half A alone (confirmed_bar == null) RM-01's complete final state and full reason-code set were Phase-2 assertable; here only bars 0-9 plus correct identification of the stop index are. \"The gate is strengthened\" is TRUE of the gate as a whole — RM-01 goes from no mechanical guard at all to a comparison contract — and FALSE of RM-01's own assertable surface. Neither sentence may travel without the other."
  },
  "not_asserted": {
    "fields": [
      "frozen_line",
      "final_state",
      "BROKEN_OUT",
      "BREAKOUT_CONFIRMED",
      "bars_after_stop_index"
    ],
    "rationale": "SPR-D-01 limit 1. Phase 3 owns confirmed breakout, retest, failure and expiry by Product Owner ruling, so this file asserts line_at_stop and NOT the frozen line Λ^F, and asserts no BROKEN_OUT state and no BREAKOUT_CONFIRMED reason code. tools/fixture-replay.mjs asserts these exclusions in both directions: it fails if this list shrinks, and it fails if the fixture starts carrying the forbidden fields."
  },
  "params": {
    "eps": 0.02,
    "eps_touch": 0.01,
    "eps_break": 0.01,
    "eps_break_locked": false,
    "min_formation_bars": 8,
    "min_ath_age_bars": 3,
    "tolerance_version": "tol-2026.07-illustrative"
  },
  "input_binding": {
    "input_csv": "input.csv",
    "input_csv_sha256": "a2a4c4cb9beb81dc200c071d1f1c7c2dfcbb1ad14d6302b9c2c755e9914a802b",
    "bar_count": 29,
    "timestamp_kind": "iso_date",
    "price_field_for_geometry": "high"
  },
  "formation": {
    "t_form": 8,
    "B_star_at_formation": {
      "t": 3,
      "H": 213.7999
    },
    "log_slope_at_formation": -0.0539003,
    "gate_trace": [
      {
        "t": 0,
        "eligible": false,
        "reason": "INSUFFICIENT_BARS",
        "f1": "|S_t|=0>=8:FAIL",
        "f2": "tA=null<=(t-1)-3:FAIL",
        "f3": "B*_t exists:FAIL"
      },
      {
        "t": 1,
        "eligible": false,
        "reason": "INSUFFICIENT_BARS",
        "f1": "|S_t|=1>=8:FAIL",
        "f2": "tA=0<=(t-1)-3:FAIL",
        "f3": "B*_t exists:FAIL"
      },
      {
        "t": 2,
        "eligible": false,
        "reason": "INSUFFICIENT_BARS",
        "f1": "|S_t|=2>=8:FAIL",
        "f2": "tA=1<=(t-1)-3:FAIL",
        "f3": "B*_t exists:FAIL"
      },
      {
        "t": 3,
        "eligible": false,
        "reason": "INSUFFICIENT_BARS",
        "f1": "|S_t|=3>=8:FAIL",
        "f2": "tA=2<=(t-1)-3:FAIL",
        "f3": "B*_t exists:FAIL"
      },
      {
        "t": 4,
        "eligible": false,
        "reason": "INSUFFICIENT_BARS",
        "f1": "|S_t|=4>=8:FAIL",
        "f2": "tA=2<=(t-1)-3:FAIL",
        "f3": "B*_t exists:ok"
      },
      {
        "t": 5,
        "eligible": false,
        "reason": "INSUFFICIENT_BARS",
        "f1": "|S_t|=5>=8:FAIL",
        "f2": "tA=2<=(t-1)-3:FAIL",
        "f3": "B*_t exists:ok"
      },
      {
        "t": 6,
        "eligible": false,
        "reason": "INSUFFICIENT_BARS",
        "f1": "|S_t|=6>=8:FAIL",
        "f2": "tA=2<=(t-1)-3:ok",
        "f3": "B*_t exists:ok"
      },
      {
        "t": 7,
        "eligible": false,
        "reason": "INSUFFICIENT_BARS",
        "f1": "|S_t|=7>=8:FAIL",
        "f2": "tA=2<=(t-1)-3:ok",
        "f3": "B*_t exists:ok"
      },
      {
        "t": 8,
        "eligible": true,
        "reason": null,
        "f1": "|S_t|=8>=8:ok",
        "f2": "tA=2<=(t-1)-3:ok",
        "f3": "B*_t exists:ok"
      },
      {
        "t": 9,
        "eligible": true,
        "reason": null,
        "f1": "|S_t|=9>=8:ok",
        "f2": "tA=2<=(t-1)-3:ok",
        "f3": "B*_t exists:ok"
      },
      {
        "t": 10,
        "eligible": true,
        "reason": null,
        "f1": "|S_t|=10>=8:ok",
        "f2": "tA=2<=(t-1)-3:ok",
        "f3": "B*_t exists:ok"
      }
    ]
  },
  "as_of_time_selection": [
    {
      "t": 0,
      "date": "2026-06-12",
      "B_star_t": null,
      "B_star_H": null,
      "log_slope": null,
      "intercept": null,
      "y_hat": null,
      "line": null,
      "no_line_reason": "INSUFFICIENT_BARS"
    },
    {
      "t": 1,
      "date": "2026-06-15",
      "B_star_t": null,
      "B_star_H": null,
      "log_slope": null,
      "intercept": null,
      "y_hat": null,
      "line": null,
      "no_line_reason": "INSUFFICIENT_BARS"
    },
    {
      "t": 2,
      "date": "2026-06-16",
      "B_star_t": null,
      "B_star_H": null,
      "log_slope": null,
      "intercept": null,
      "y_hat": null,
      "line": null,
      "no_line_reason": "INSUFFICIENT_BARS"
    },
    {
      "t": 3,
      "date": "2026-06-17",
      "B_star_t": null,
      "B_star_H": null,
      "log_slope": null,
      "intercept": null,
      "y_hat": null,
      "line": null,
      "no_line_reason": "INSUFFICIENT_BARS"
    },
    {
      "t": 4,
      "date": "2026-06-18",
      "B_star_t": null,
      "B_star_H": null,
      "log_slope": null,
      "intercept": null,
      "y_hat": null,
      "line": null,
      "no_line_reason": "INSUFFICIENT_BARS"
    },
    {
      "t": 5,
      "date": "2026-06-22",
      "B_star_t": null,
      "B_star_H": null,
      "log_slope": null,
      "intercept": null,
      "y_hat": null,
      "line": null,
      "no_line_reason": "INSUFFICIENT_BARS"
    },
    {
      "t": 6,
      "date": "2026-06-23",
      "B_star_t": null,
      "B_star_H": null,
      "log_slope": null,
      "intercept": null,
      "y_hat": null,
      "line": null,
      "no_line_reason": "INSUFFICIENT_BARS"
    },
    {
      "t": 7,
      "date": "2026-06-24",
      "B_star_t": null,
      "B_star_H": null,
      "log_slope": null,
      "intercept": null,
      "y_hat": null,
      "line": null,
      "no_line_reason": "INSUFFICIENT_BARS"
    },
    {
      "t": 8,
      "date": "2026-06-25",
      "B_star_t": 3,
      "B_star_H": 213.7999,
      "log_slope": -0.0539003,
      "intercept": 5.52674,
      "y_hat": 5.09554,
      "line": 163.292,
      "no_line_reason": null
    },
    {
      "t": 9,
      "date": "2026-06-26",
      "B_star_t": 3,
      "B_star_H": 213.7999,
      "log_slope": -0.0539003,
      "intercept": 5.52674,
      "y_hat": 5.04164,
      "line": 154.723,
      "no_line_reason": null
    }
  ],
  "reselections": [
    {
      "effective_bar": 10,
      "from": 3,
      "to": 9,
      "log_slope": -0.0505453,
      "tie": false
    }
  ],
  "line_at_stop": {
    "stop_index": 10,
    "date": "2026-06-29",
    "stop_index_is_engine_derived": true,
    "A": {
      "t": 2,
      "H": 225.64
    },
    "B": {
      "t": 9,
      "H": 158.4,
      "date": "2026-06-26"
    },
    "log_slope": -0.0505453,
    "intercept": 5.52003,
    "y_hat": 5.01458,
    "line": 150.593,
    "close": 164.19,
    "close_vs_line_log": 0.0864461,
    "close_vs_line_plus_eps_break_log": 0.0764461
  },
  "robustness": {
    "eps_break_sweep": [
      {
        "eps_break": 0.005,
        "t_form": 8,
        "stop_index": 10
      },
      {
        "eps_break": 0.008,
        "t_form": 8,
        "stop_index": 10
      },
      {
        "eps_break": 0.01,
        "t_form": 8,
        "stop_index": 10
      },
      {
        "eps_break": 0.012,
        "t_form": 8,
        "stop_index": 10
      },
      {
        "eps_break": 0.02,
        "t_form": 8,
        "stop_index": 10
      },
      {
        "eps_break": 0.05,
        "t_form": 8,
        "stop_index": 10
      }
    ],
    "eps_sweep": [
      {
        "eps": 0.01,
        "t_form": 8,
        "stop_index": 10
      },
      {
        "eps": 0.016,
        "t_form": 8,
        "stop_index": 10
      },
      {
        "eps": 0.02,
        "t_form": 8,
        "stop_index": 10
      },
      {
        "eps": 0.024,
        "t_form": 8,
        "stop_index": 10
      },
      {
        "eps": 0.04,
        "t_form": 8,
        "stop_index": 10
      }
    ],